{
  "version": "1.0.0",
  "metadata": {
    "title": "Stripe Homepage Reference",
    "width": 1920,
    "height": 1080,
    "fps": 60,
    "totalDurationSec": 10
  },
  "theme": {
    "stylePreset": "Apple",
    "colors": {
      "background": "#000000",
      "surface": "#111111",
      "primary": "#FFFFFF",
      "secondary": "#A1A1A6",
      "text": "#F5F5F7",
      "mutedText": "#86868B",
      "accent": "#0066CC",
      "border": "#424245",
      "charts": ["#0066CC"]
    },
    "typography": {
      "headingFont": "Inter",
      "bodyFont": "Inter",
      "monoFont": "monospace"
    },
    "glassmorphism": true,
    "borderRadius": 24
  },
  "scenes": [
    {
      "id": "scene-1",
      "type": "ChartShowcase",
      "durationFrames": 600,
      "props": {
        "title": "Revenue Growth",
        "subtitle": "Up and to the right.",
        "data": [10, 25, 45, 80, 150]
      }
    }
  ]
}
