{
  "version": "1.0.0",
  "metadata": {
    "title": "Pixel Camera Transition Reference",
    "width": 1920,
    "height": 1080,
    "fps": 60,
    "totalDurationSec": 8
  },
  "theme": {
    "stylePreset": "Apple",
    "colors": {
      "background": "#000000",
      "surface": "#111111",
      "primary": "#FFFFFF",
      "secondary": "#A1A1A6",
      "text": "#F5F5F7",
      "mutedText": "#86868B",
      "accent": "#0066CC",
      "border": "#424245",
      "charts": ["#0066CC"]
    },
    "typography": {
      "headingFont": "Inter",
      "bodyFont": "Inter",
      "monoFont": "monospace"
    },
    "glassmorphism": true,
    "borderRadius": 24
  },
  "scenes": [
    {
      "id": "scene-1",
      "type": "SplitScreen",
      "durationFrames": 480,
      "props": {
        "layout": "image-right",
        "headline": "Pro-level photos.",
        "description": "Every detail matters.",
        "imageUrl": "https://images.unsplash.com/photo-1516339901601-2e1b62dc0c45?auto=format&fit=crop&q=80&w=800",
        "items": [
          { "text": "50MP Main Sensor", "icon": "📷" },
          { "text": "Ultra Wide Lens", "icon": "🔍" }
        ]
      }
    }
  ]
}
